Place_Id,Place_Name,Description,Categories,City,Price(RPH),Ratings,Time_Minutes,Coordinate,lat,Long
307,Malabar Tea Plantation,"One of the well-known tea plantations in West Java is the Malabar tea plantation which was built during the Dutch colonial period in 1896. This plantation is included in the Pangalengan sub-district, Bandung Regency, approximately 45 km from the center of Bandung City. If you visit this area, your eyes will be spoiled by the activities of the local population, where the majority of the population work as tea pickers and raise dairy cows. So don't be surprised if you enter this area, you will see residents picking tea gardens and raising cows. However, to reach the Malabar plantation in Pangalengan, you have to take a long and winding journey, so you have to be careful.",Nature preserve,Bandung,5000,4.4,,"{'lat': -7.2274463, 'lng': 107.6050805}",-7.2274463,107.6050805
308,Ciater Hot Springs,"In Subang, there is the Ciater Hot Spring area which is often the target of tourists. This tourist area which is open 24 hours has a water temperature of around 43-46 degrees Celsius. It is suitable for refreshing the body of tourists. There are various hot spring pools here. Both for adults and children. The water temperature in the children's pool is limited to 39 degrees Celsius, while the adult pool can reach 46 degrees Celsius.",Nature preserve,Bandung,15000,4.3,,"{'lat': -6.738085299999999, 'lng': 107.6566092}",-6.7380853,107.6566092
309,Bosscha Observatory,"Bosscha Observatory is one of the oldest star observation sites in Indonesia. The Bosscha Observatory (formerly known as Bosscha Sterrenwacht) was built by the Nederlandsch-Indische Sterrenkundige Vereeniging (NISV) or the Dutch East Indies Star Association. The Bosscha Observatory is located in Lembang, West Java, about 15 km to the north of the city of Bandung with geographic coordinates 107ø 36' East Longitude and 6ø 49' South Latitude. This place stands on 6 hectares of land, and is located at an altitude of 1310 meters above sea level or at an altitude of 630 m from the Bandung plateau. The observatory code of the International Astronomical Union for the Bosscha observatory is 299. In 2004, the Bosscha Observatory was declared a Cultural Heritage Object by the Government. Because of that the existence of the Bosscha Observatory is protected by Law Number 2/1992 concerning Cultural Heritage Objects. Furthermore, in 2008, the Government established the Bosscha Observatory as one of the national Vital Objects that must be secured.",Nature preserve,Bandung,25000,4.5,,"{'lat': -6.8246311, 'lng': 107.6171106}",-6.8246311,107.6171106
310,Cihideung Flower Park,Cihideung Flower Garden has a simple natural charm but is able to produce a landscape that grabs attention. The charm of this garden / flower garden is only limited to a type of flower plant. Then there are also several other attractions that make this natural tourist destination included in the Bandung tourist list. One of them is the photo spot area which is very contemporary and instagramable which is the main target of teenage tourists. Especially for influencers who are looking for the perfect backdrop for content.,Nature preserve,Bandung,0,4.1,45,"{'lat': -6.8038883, 'lng': 107.5866313}",-6.8038883,107.5866313
311,The Lodge Maribaya,"The Lodge Maribaya is one of the tourist attractions in Lembang that offers various things to visitors. Here we can do various activities such as camping, trekking around the beautiful pine forest area, gathering and team building events, or even just refreshing to enjoy culinary delights. There are also various rides which are definitely very instagrammable. Surrounded by mountains with distinctive pine forests, the air and atmosphere here are really fresh. Want to hold a private gathering, or even a wedding here? really can. With a beautiful green mountain backdrop, of course, it will make your event more memorable.",Nature preserve,Bandung,25000,4.3,150,"{'lat': -6.829411199999999, 'lng': 107.6874666}",-6.8294112,107.6874666
312,Forest Park Ir. H. Juanda,"Forest Park Ir. H. Djuanda (Tahura Djuanda) is a conservation area that is integrated between secondary nature and plantation forests of the Pinus type (Pinus merkusil) located in the Cikapundung River Sub-Watershed and the Citarum Watershed which stretches from Curug Dago, Dago Pakar to Curug Maribaya which is part of the Pulosari Mountain forest group. Tahura Djuanda is located in the north of Bandung City, approximately 7 km from the city center, geographically located at 1070 30' East Longitude and 60 52' South Latitude, administratively it is in the area of Ciburial Village, Cimenyan District, Bandung Regency and partly belongs to the Village Mekarwangi, Cibodas Village, Langensari Village, and Wangunharja Village, Lembang District, West Bandung Regency and Dago Village, Coblong District, Bandung City.",Nature preserve,Bandung,11000,4.5,90,"{'lat': -6.8585841, 'lng': 107.6306089}",-6.8585841,107.6306089
313,Begonia Garden,"Bandung Begonia Garden is located at an altitude of 1200 meters above sea level. Apart from Balinea, there are various other types of flowers such as salvia, impatiens, geraniums and celosia. So beautiful that many people call it the equivalent of the Himawari no Sato park in Japan. The Balinea flower itself is a type of Begonia flower originating from Bali. Plants that are suitable for planting in various weather conditions will grow throughout the season. Balinea flowers are plants that are often planted in plantations and hotel grounds as well as city parks. The specialty of the Begonia Flower Garden is not only the presence of flowers and plants, but also an attractive garden arrangement. The colorful flower garden is also equipped with various shapes that are suitable for taking pictures. In fact, many visitors come here just to capture the beauty of the park. In addition, because it is located in the highlands, visitors will definitely be comfortable doing activities there with cool and refreshing temperatures.",Nature preserve,Bandung,10000,4.4,90,"{'lat': -6.8260163, 'lng': 107.6383564}",-6.8260163,107.6383564
314,Tafso Barn,"The name Punclut may be quite familiar to tourists. The highland area in Bandung has recently become popular as a tourist destination. Besides offering beautiful scenery, this area also has many tourist attractions for recreation. One of them is the tourist area as well as the restaurant Tafso and Boda Barn or often known as Tafso Barn. This recreation area combines dining with a unique garden and warehouse feel. Views of the hills cut by the horizon line are the main target of visitors. It is perfect to hang out and relax while on vacation in Bandung.",Nature preserve,Bandung,0,4.2,180,"{'lat': -6.8426446, 'lng': 107.6228408}",-6.8426446,107.6228408
315,Curug Luhur Waterfall,"Around Bandung, there are lots of waterfalls from the current ones, forgotten, not heard of until just heard of. One of them is the Luhur Cibodas waterfall in the Maribaya Lembang area around this area there are 3 waterfalls, the local people call it the Cibodas waterfall. again the highest waterfall in this area is Luhur waterfall.. the position is even deeper, about 3 km from the entry post, there are still very few people going there",Nature preserve,Bandung,5000,4.2,,"{'lat': -6.8131767, 'lng': 107.7136367}",-6.8131767,107.7136367
316,Malela Waterfall,"Curug Malela is one of the natural destinations in the form of a waterfall. This waterfall has extraordinary beauty. So it's no wonder that many visitors come to visit this waterfall. The visitors who come are not only from within the city, but also from outside the city such as DKI Jakarta, Central Java, West Java and many more. This waterfall has a fairly high height, which is around 60 to 70 meters. However, this waterfall has a fairly narrow width, which is only about 50 meters. This towering waterfall has very heavy and cold water. So if you stand near this waterfall, be prepared for your clothes to get wet with splashes of water. Malela Waterfall does not only consist of one shower, but consists of several adjacent showers. Because this waterfall has showers that line up like Niagara Falls in America, many visitors call it ""Cianjur's Niagara"".",Nature preserve,Bandung,10000,4.4,,"{'lat': -7.0182386, 'lng': 107.2072145}",-7.0182386,107.2072145
317,Cimahi Waterfall,"Curug Cimahi is a waterfall located on Jalan Colonel Masturi, Kertawangi Village, Cisarua District, West Bandung Regency, West Java. With a height of about 87 meters, this waterfall is one of the highest waterfalls in Bandung and its surroundings. The name Cimahi comes from the name of the river that flows over it, namely the Cimahi River, which originates in Situ (lake) Lembang and flows into Cimahi City. This tourist destination is approximately 10 kilometers from Cimahi City in the direction of Lembang or 20 kilometers from Bandung City.",Nature preserve,Bandung,15000,4.6,30,"{'lat': -6.797738300000002, 'lng': 107.5783691}",-6.7977383,107.5783691
318,Situ Patenggang,"Situ Patenggang or Situ Patengan is a lake located in the natural tourist area of South Bandung, West Java, Indonesia, to be precise in Ciwidey. Located at an altitude of 1600 meters above sea level, this lake has very exotic views. Situ Patenggang also has beautiful natural scenery, because there are tea gardens around it. The area of Situ Patenggang is around 45,000 hectares. And the total area of the nature reserve reaches 123,077.15 hectares. Situ patenggang is always the choice of tourists, especially for those who have just returned from the White Crater tourist spot. The distance from the white crater tour is only about 7 KM and takes about 10 minutes.",Nature preserve,Bandung,20000,4.5,,"{'lat': -7.1669649, 'lng': 107.3575344}",-7.1669649,107.3575344
319,Rengganis Cibuni Crater,"The South Bandung area, especially Ciwidey, is already known as a natural tourist destination with beautiful panoramas and cool air, that's why urban people choose to travel to Ciwidey to ""escape"" themselves from their busy lives in the city. This Ciwidey tour is no less exotic than the White Crater, Rancaupas or Situ Patenggang. Based on historical records of Rengganis Crater, this crater was formed as a result of natural processes millions of years ago. Where based on research, Rengganis Crater was formed from the enormity of the eruption of Mount Sunda Purba, especially Mount Patuha, which also created another crater, Kawah Putih. We can see the evidence of the awesomeness of the eruption for ourselves, where until now in Rengganis Crater there is still a very strong smell of sulfur from the crater area.",Nature preserve,Bandung,5000,4.3,,"{'lat': -7.172412599999999, 'lng': 107.3766656}",-7.1724126,107.3766656
320,Cimanggu Hot Springs,Cimanggu Hot Spring is one of the tourist attractions in Bandung that offers a variety of attractions that are guaranteed to be amazing. This tourist spot is also known as Cimanggu Natural Hot Spring. Enjoying hot springs and also the green scenery in this bath can certainly make your mind more relaxed. A relaxed mind will definitely make you more excited when you get back to work.,Nature preserve,Bandung,23000,3.9,60,"{'lat': -7.147152899999998, 'lng': 107.3901424}",-7.1471529,107.3901424
321,Glamping Lakeside Rancabali,"Glamping Lakeside Rancabali offers a luxurious camping spot that is suitable for you to make a weekend getaway. As the name suggests, glamping or glamor camping consists of tents containing comfortable beds, indoor bathrooms, heaters, and various amenities like a five-star hotel. Located on Jalan Raya Ciwidey Rancabali KM 1, Glamping Lakeside is in the vicinity of Situ Patenggang and lush tea plantations. It's no wonder that the view from glamping is so beautiful and Instagramable for taking pictures.",Amusement park,Bandung,30000,4.4,,"{'lat': -7.167590799999999, 'lng': 107.3532419}",-7.1675908,107.3532419
322,Mushroom Hill,"Ciwidey Mushroom Hill is one of the many natural tourist charms located in Ciwidey District, Bandung Regency, West Java Province. Ciwidey Mushroom Hill does have a typical Ciwidey tour, which is a tourist attraction in the middle of a stretch of tea gardens, with very cool air. The atmosphere when the fog falls over the plantation area makes the atmosphere romantic. The atmosphere at Bukit Mushroom Ciwidey is also suitable for single people, there are many spots with beautiful natural backgrounds, where it is possible to forget your ex.",Nature preserve,Bandung,0,4.2,,"{'lat': -7.195110199999998, 'lng': 107.4312811}",-7.1951102,107.4312811
323,Sari Alam Medicinal Plant Garden,"Sari Alam Medicinal Plant Garden is better known as herbal medicine tourism, because there are lots of plants used as alternative medicine. Sari Alam Medicinal Plant Garden is better known by Bandung people as KTO Sari Alam. Location: Jl. Raya Ciwidey bandung km 26 no 8 rt 1 rw 2 village Andir, Cukangenteng, Kec. Pasirjambu, Bandung district, West Java 40972",Nature preserve,Bandung,0,4.9,90,"{'lat': -6.601320999999999, 'lng': 106.632734}",-6.601321,106.632734
324,Happyfarm Ciwidey,"Natural and educational tourism objects have mushroomed lately. Apart from De Ranch and Lembang Farmhouse, there is also Happy Farm Ciwidey in Bandung. This tourist attraction is still relatively new, because it was only established in June 2019. The concept is almost the same, nature tourism and animal husbandry with educational elements. It is suitable to be a family tourist destination, especially for children. And it's even more exciting because playing in an outdoor area with cool air.",Nature preserve,Bandung,15000,4.2,90,"{'lat': -7.1147877, 'lng': 107.4380865}",-7.1147877,107.4380865
325,Saung Angklung Mang Udjo,"Saung Angklung Udjo (SAU) is a place that is a place for performances, a center for handicrafts made of bamboo, and workshops for musical instruments made of bamboo. In addition, SAU has a goal as an educational laboratory and learning center to maintain Sundanese culture and especially angklung. Founded in 1966 by Udjo Ngalagena and his wife Uum Sumiati, with the intention of preserving and maintaining traditional Sundanese art and culture. Located on Jalan Padasuka 118, East Bandung, West Java, Indonesia. With an atmosphere of fresh air and surrounded by bamboo trees, from bamboo handicrafts and bamboo interiors to bamboo musical instruments. Besides regular performances every evening, Saung Angklung Udjo has repeatedly held special performances which are held in the morning or afternoon. The show was not limited to being held at the location of Saung Angklung Udjo, but various invitations appeared in various places both at home and abroad, in August 2000 at Sasana Budaya Ganesha ITB, Bandung, Saung Angklung Udjo held a collaboration concert with young singers who nicknamed the Shirley Temple of Indonesia, namely Sherina. Saung Angklung Udjo is not limited to selling only performing arts, various products of traditional bamboo musical instruments (angklung, arumba, calung and others) are made and sold to buyers.",Culture,Bandung,75000,4.7,,"{'lat': -6.897136199999999, 'lng': 107.6558466}",-6.8971362,107.6558466
326,Cihanjuang Butterfly Park,"The Cihanjuang Butterfly Park in Bandung seems to have added to the list of unique and interesting tourist attractions in Bandung, such as the Jendela Alam Bandung theme park, as well as having very high educational value for children and as a learning tool for our children that the preservation of rare and beautiful animals This can be taught from an early age. And in fact, even though it is still relatively new, this family tourist spot in Bandung has in fact succeeded in attracting the attention of local tourists from the city of Bandung and tourists from outside the area who are on vacation in Bandung. The location of the tourist spot which is still very shady and cool, is supported again by the interior design of the butterfly garden which is laid out in a very detailed and attractive way. When traveling to this one tourist area, it is hoped that your children will be able to get information about how the process of metamorphosis of a butterfly starts from the seedling larva to growing up perfectly.",Nature preserve,Bandung,10000,4,,"{'lat': -6.8590047, 'lng': 107.568779}",-6.8590047,107.568779
327,Railway Miniature Park,"One of the bustling tours in Bandung is the Train Miniature Park which is in the Floating Market Lembang tourist park. By presenting complete and very detailed railroad knick-knacks, this miniature train park seems to really come alive. It is not surprising that this tourist attraction invites thousands of people to enjoy and learn a lot about railways both in Indonesia and the world. This miniature park provides a gift shop that sells various types of miniature vehicles ranging from cars, planes and trains, of course. In addition, visitors who want to enjoy a variety of culinary offerings can go directly to the Lembang Floating Market. For visitors who come from out of town can stay at hotels adjacent to the location of the miniature park. The distance from the hotel to the miniature park is around 200 meters to 1 kilometer. These hotels include the Grand Hotel Lembang, Cemara Asri Hotel, Buah Sinuan Hotel and Pesona Bamboe Hotel. Hotel rental rates for overnight stays are between Rp. 200,000 to Rp. 1,000,000.",Amusement park,Bandung,15000,4.4,,"{'lat': -6.817327, 'lng': 107.61794}",-6.817327,107.61794
328,Pawon Cave,"Pawon Cave is a natural cave and ancient site located in Gunung Masigit Village, Cipatat District, Padalarang, West Bandung Regency, or about 25 km west of Bandung City. It is an important place for the Sundanese because it is where the Sundanese elders who now occupy the western part of the island of Java gather. There, an ancient human skeleton was found there which is said to be the ancestor of the Sundanese people (still being studied at the Bandung Archaeological Center).",Nature preserve,Bandung,10000,4.5,90,"{'lat': -6.8231833, 'lng': 107.4371655}",-6.8231833,107.4371655
329,Gantole Hill Cililin,Gantole Hill Cililin or also known as Venue Gantole is a tourist area which was originally opened for the purpose of holding the 2010 West Java Porda and the 2016 National Sports Week Paragliding. This tourist area became a byword after hosting the 2016 PON. Paragliding itself is a type of sport that is carried out on hillsides or mountains by only utilizing wind as the main source. Therefore the location of Cililin Gantole Hill which is at an altitude of 1063 masl with strong winds is perfect for this sport.,Nature preserve,Bandung,0,4.4,45,"{'lat': -6.9588812, 'lng': 107.4713147}",-6.9588812,107.4713147
330,Bandros City Tour,"Bandros or Bandung Tour Bus is a tour bus operating in Bandung, West Java, Indonesia. Used by tourists in the city of Bandung. The bus was inaugurated by Mayor of Bandung Ridwan Kamil on New Year's Eve 2014, and on February 18 2018 it was announced that the tour bus would serve the city of Bandung. A local tour leader will accompany tourists on the bus. Bandros is managed by two parties: the Bandung Transportation Agency (which is related to the Regional Revenue and Expenditure Budget) and Mang Dudung which is part of Corporate Social Responsibility. The bus has a capacity of 22 people. There are six buses operated by the Corporate Social Responsibility division, and 12 buses operated by the Regional Revenue and Expenditure Budget which are managed by the BLUD UPT Bandung City Transportation Service.",Culture,Bandung,40000,4.4,,"{'lat': -6.922081599999999, 'lng': 107.6073182}",-6.9220816,107.6073182
331,Kyotoku Floating Market,"Kyotoku Floating Market Bandung, a contemporary tour that carries the theme of Japanese things. In this place you will see typical Japanese buildings and views like in the land of Sakura. Japan is one of the countries besides South Korea which is a favorite destination for tourists from Indonesia. Because it is already a developed country, visiting Japan requires a lot of accommodation costs, plane tickets, and a complicated visa processing process. You don't need to go far abroad, you can enjoy traveling with Japanese nuances in Bandung. The tour manager designed this place to be similar to Kyoto, an area in Japan that is thick with culture. You don't have to wait for April to see the cherry blossoms, which are a Japanese icon. This tourist area is decorated with cherry blossoms so that the Japanese atmosphere feels even thicker. For those of you who are interested in taking pictures wearing kimono or yukata with a Japanese-style background, fortunately they are displayed on Instagram. The following is a brief review of this tourist area.",Culture,Bandung,175000,4.5,150,"{'lat': -6.819874999999999, 'lng': 107.618707}",-6.819875,107.618707
332,Rainbow Gardens,"Rainbow Garden Harapan Indah is one of the recreational parks especially suitable for families. With an 'eat and play' concept, Rainbow Garden Bekasi combines a children's play area with culinary tours. Various rides and activities are available in this colorful 3000 m2 tourist park.",Nature preserve,Bandung,20000,4.6,90,"{'lat': -6.8179514, 'lng': 107.618914}",-6.8179514,107.618914
333,Mini Town,"Very interesting destinations with European nuances complete with public facilities that make you feel as if you are in Europe. There are hospitals, police stations, telephone boxes, roadside cafes, and other classic buildings. Still in the same complex as the Floating Market, this tourist spot presents classic European architecture that is so thick, you are guaranteed to be reluctant to leave.",Amusement park,Bandung,20000,4.4,,"{'lat': -6.818688799999999, 'lng': 107.6169403}",-6.8186888,107.6169403
334,Chingu Cafe Little Seoul,"Besides being popular because it has beautiful scenery and cool weather, Bandung also offers many creative tourist destinations. City parks, museums, and places to eat are not spared from the uniqueness and appeal of each. One of them is Little Seoul Bandung which is in the Chingu Caf‚ area. The outdoor area at this cafe is transformed to resemble the atmosphere of Dongdaemun Street in Seoul, South Korea. Without having to fly all the way to Ginseng Country, visitors can feel the atmosphere of Seoul here.",Amusement park,Bandung,50000,4.5,,"{'lat': -6.901224099999999, 'lng': 107.6099853}",-6.9012241,107.6099853
335,Gedong Songo Temple,"Gedong Songo Temple (Javanese: ˆ??ˆ??ˆ??ˆ? ˆ??ƒ??ˆ?'ˆ?¬ˆ? ˆ?§ˆ??ˆ? ƒ??ˆ?ñˆ?"", translit. Candi Gedhong Sanga) is the name of a complex of Hindu cultural heritage temple buildings located in Candi village, Bandungan District, Semarang Regency, Central Java, Indonesia to be precise on the slopes of Mount Ungaran. In this temple complex there are nine temples. This temple was discovered by Raffles in 1804 and is a relic of Hindu culture from the 9th century Syailendra Dynasty (927 AD). This temple has similarities with the Dieng Temple complex in Wonosobo. This temple is located at an altitude of about 1,200 m above sea level, so the air temperature here is quite cold (ranging from 19-27 ?øC). The location of the nine temples scattered on the slopes of Mount Ungaran has beautiful natural scenery. In addition, this tourist attraction is also equipped with hot springs from springs containing sulfur, camping areas, and horseback riding tours.",Culture,Semarang,10000,4.5,,"{'lat': -7.209886700000002, 'lng': 110.3421119}",-7.2098867,110.3421119
336,Grand Maerachaka,"The people of Central Java may already be familiar with the name ""Puri Maerokoco"". This tourist park is the Central Javanese version of ""Taman Mini"" which presents replicas and miniatures of typical buildings from various regions in Central Java. Currently, Puri Maerakaca has changed its name to Grand Maerakaca. With more varied rides, this recreational park is one of the tourist destinations in Semarang which is suitable for family recreation.",Amusement park,Semarang,15000,4.4,,"{'lat': -6.9605225, 'lng': 110.3863941}",-6.9605225,110.3863941
337,Rainbow Village,"Kampung Pelangi or in English is called Rainbow Village is a designation for areas or villages where the houses of the people are painted in colorful colors. Actually Kampung Pelangi was originally a slum area which was creatively transformed into an attractive area to serve as a tourist destination, especially for people who are happy or looking for an interesting spot to capture the moment. Many areas in Indonesia, especially in Java have places called Kampung Pelangi, among others, in Malang, Semarang, Jakarta, Bandung, and other cities. An example of a village like this is the colorful village in Jodipan and Tridi, Malang City, East Java.",Amusement park,Semarang,3000,4.3,30,"{'lat': -6.988881200000001, 'lng': 110.4083781}",-6.9888812,110.4083781
338,Lawang Sewu,"Lawang Sewu (""Thousand Doors"") (Javanese: ˆ?ˆ??ˆ? ƒ??ˆ?ñˆ?§ˆ??ˆ??, translit. Lawang S??wu) is a landmark in Semarang, Central Java, Indonesia , which was built as the headquarters of the Dutch East Indies Railway Company. The colonial-era building is notorious as a haunted house and filming location, although the Semarang city government has been trying to change that image.",Culture,Semarang,10000,4.6,,"{'lat': -6.9839099, 'lng': 110.4104342}",-6.9839099,110.4104342
